Title,Link,Description
How AI will change the auto business,https://www.mckinsey.com/~/media/McKinsey/Business%20Functions/McKinsey%20Digital/Our%20Insights/Building%20smarter%20cars/Building-smarter-cars-with-smarter-factories.pdf,How AI will change the auto business can be explored further at [this link](https://www.mckinsey.com/~/media/McKinsey/Business%20Functions/McKinsey%20Digital/Our%20Insights/Building%20smarter%20cars/Building-smarter-cars-with-smarter-factories.pdf).
Transforming automotive R&D with gen AI,https://www.mckinsey.com/industries/automotive-and-assembly/our-insights/automotive-r-and-d-transformation-optimizing-gen-ais-potential-value,Transforming automotive R&D with gen AI can be explored further at [this link](https://www.mckinsey.com/industries/automotive-and-assembly/our-insights/automotive-r-and-d-transformation-optimizing-gen-ais-potential-value).
Artificial intelligence as auto companies' new engine of value,https://www.mckinsey.com/industries/automotive-and-assembly/our-insights/artificial-intelligence-as-auto-companies-new-engine-of-value,Artificial intelligence as auto companies' new engine of value can be explored further at [this link](https://www.mckinsey.com/industries/automotive-and-assembly/our-insights/artificial-intelligence-as-auto-companies-new-engine-of-value).
The future is now: Unlocking the promise of AI in industrials,https://www.mckinsey.com/industries/automotive-and-assembly/our-insights/the-future-is-now-unlocking-the-promise-of-ai-in-industrials,The future is now: Unlocking the promise of AI in industrials can be explored further at [this link](https://www.mckinsey.com/industries/automotive-and-assembly/our-insights/the-future-is-now-unlocking-the-promise-of-ai-in-industrials).
Applying artificial intelligence to automotive marketing and ...,https://www.mckinsey.com/industries/automotive-and-assembly/our-insights/winning-tomorrows-car-buyers-using-artificial-intelligence-in-marketing-and-sales,Applying artificial intelligence to automotive marketing and ... can be explored further at [this link](https://www.mckinsey.com/industries/automotive-and-assembly/our-insights/winning-tomorrows-car-buyers-using-artificial-intelligence-in-marketing-and-sales).
